
> laboratorio1@0.0.0 test
> ng test

[33m❯[39m Building...
[32m✔[39m Building...
[1mInitial chunk files[22m                   [2m | [22m[1mNames[22m                              [2m | [22m [1mRaw size[22m
[32mchunk-H3KBRXWJ.js[39m                     [2m | [22m[2m-[22m                                  [2m | [22m  [36m2.27 MB[39m[2m | [22m
[32mpolyfills.js[39m                          [2m | [22m[2mpolyfills[22m                          [2m | [22m  [36m1.04 MB[39m[2m | [22m
[32mspec-app.spec.js[39m                      [2m | [22m[2mspec-app.spec[22m                      [2m | [22m[36m259.55 kB[39m[2m | [22m
[32mspec-cliente-manager.component.spec.js[39m[2m | [22m[2mspec-cliente-manager.component.spec[22m[2m | [22m[36m249.56 kB[39m[2m | [22m
[32mchunk-MGLCZJAX.js[39m                     [2m | [22m[2m-[22m                                  [2m | [22m[36m197.60 kB[39m[2m | [22m
[32mchunk-J66GVLLX.js[39m                     [2m | [22m[2m-[22m                                  [2m | [22m [36m96.31 kB[39m[2m | [22m
[32mjasmine-cleanup-1.js[39m                  [2m | [22m[2mjasmine-cleanup-1[22m                  [2m | [22m [36m67.20 kB[39m[2m | [22m
[32mchunk-P3ZQIA2L.js[39m                     [2m | [22m[2m-[22m                                  [2m | [22m [36m43.45 kB[39m[2m | [22m
[32mtest_main.js[39m                          [2m | [22m[2mtest_main[22m                          [2m | [22m [36m21.90 kB[39m[2m | [22m
[32mchunk-QJHQZUO7.js[39m                     [2m | [22m[2m-[22m                                  [2m | [22m [36m12.24 kB[39m[2m | [22m
[32mspec-vendedor.service.spec.js[39m         [2m | [22m[2mspec-vendedor.service.spec[22m         [2m | [22m  [36m9.22 kB[39m[2m | [22m
[32mspec-vendor.service.spec.js[39m           [2m | [22m[2mspec-vendor.service.spec[22m           [2m | [22m  [36m5.01 kB[39m[2m | [22m
[32mspec-cliente.service.spec.js[39m          [2m | [22m[2mspec-cliente.service.spec[22m          [2m | [22m  [36m4.49 kB[39m[2m | [22m
[32mspec-auto.service.spec.js[39m             [2m | [22m[2mspec-auto.service.spec[22m             [2m | [22m  [36m4.07 kB[39m[2m | [22m
[32mspec-auth.service.spec.js[39m             [2m | [22m[2mspec-auth.service.spec[22m             [2m | [22m  [36m3.08 kB[39m[2m | [22m
[32mchunk-TTULUY32.js[39m                     [2m | [22m[2m-[22m                                  [2m | [22m  [36m1.99 kB[39m[2m | [22m
[32mchunk-PNRSBHEP.js[39m                     [2m | [22m[2m-[22m                                  [2m | [22m  [36m1.84 kB[39m[2m | [22m
[32mchunk-5LVQ6JZI.js[39m                     [2m | [22m[2m-[22m                                  [2m | [22m[36m936 bytes[39m[2m | [22m
[32mjasmine-cleanup-0.js[39m                  [2m | [22m[2mjasmine-cleanup-0[22m                  [2m | [22m[36m519 bytes[39m[2m | [22m
[32mstyles.css[39m                            [2m | [22m[2mstyles[22m                             [2m | [22m [36m95 bytes[39m[2m | [22m

[1m [22m                                     [2m | [22m[1mInitial total[22m                      [2m | [22m  [1m4.28 MB[22m

Application bundle generation complete. [2.699 seconds] - 2025-12-23T18:20:50.453Z

Watch mode enabled. Watching for file changes...
[33m23 12 2025 13:20:50.768:WARN [karma]: [39mNo captured browser, open http://localhost:9878/
[32m23 12 2025 13:20:50.821:INFO [karma-server]: [39mKarma v6.4.4 server started at http://localhost:9878/
[32m23 12 2025 13:20:50.822:INFO [launcher]: [39mLaunching browsers Chrome with concurrency unlimited
[32m23 12 2025 13:20:50.828:INFO [launcher]: [39mStarting browser Chrome
[32m23 12 2025 13:20:52.387:INFO [Chrome 143.0.0.0 (Windows 10)]: [39mConnected on socket SnupoAsX5HcKhxuHAAAB with id 22424111
Chrome 143.0.0.0 (Windows 10): Executed 0 of 67[32m SUCCESS[39m (0 secs / 0 secs)
[1A[2KChrome 143.0.0.0 (Windows 10): Executed 1 of 67[32m SUCCESS[39m (0 secs / 0.012 secs)
[1A[2KChrome 143.0.0.0 (Windows 10): Executed 2 of 67[32m SUCCESS[39m (0 secs / 0.014 secs)
[1A[2KChrome 143.0.0.0 (Windows 10): Executed 3 of 67[32m SUCCESS[39m (0 secs / 0.016 secs)
[1A[2KChrome 143.0.0.0 (Windows 10): Executed 4 of 67[32m SUCCESS[39m (0 secs / 0.017 secs)
[1A[2KChrome 143.0.0.0 (Windows 10): Executed 5 of 67[32m SUCCESS[39m (0 secs / 0.029 secs)
[1A[2KChrome 143.0.0.0 (Windows 10): Executed 6 of 67[32m SUCCESS[39m (0 secs / 0.031 secs)
[1A[2KChrome 143.0.0.0 (Windows 10): Executed 7 of 67[32m SUCCESS[39m (0 secs / 0.033 secs)
[1A[2KChrome 143.0.0.0 (Windows 10): Executed 8 of 67[32m SUCCESS[39m (0 secs / 0.034 secs)
[1A[2KChrome 143.0.0.0 (Windows 10): Executed 9 of 67[32m SUCCESS[39m (0 secs / 0.035 secs)
[1A[2KChrome 143.0.0.0 (Windows 10): Executed 10 of 67[32m SUCCESS[39m (0 secs / 0.084 secs)
[1A[2KChrome 143.0.0.0 (Windows 10): Executed 11 of 67[32m SUCCESS[39m (0 secs / 0.092 secs)
[1A[2KChrome 143.0.0.0 (Windows 10): Executed 12 of 67[32m SUCCESS[39m (0 secs / 0.098 secs)
[1A[2KChrome 143.0.0.0 (Windows 10): Executed 13 of 67[32m SUCCESS[39m (0 secs / 0.104 secs)
[1A[2KChrome 143.0.0.0 (Windows 10): Executed 14 of 67[32m SUCCESS[39m (0 secs / 0.11 secs)
[1A[2KChrome 143.0.0.0 (Windows 10): Executed 15 of 67[32m SUCCESS[39m (0 secs / 0.117 secs)
[1A[2KChrome 143.0.0.0 (Windows 10): Executed 16 of 67[32m SUCCESS[39m (0 secs / 0.125 secs)
[1A[2KChrome 143.0.0.0 (Windows 10): Executed 17 of 67[32m SUCCESS[39m (0 secs / 0.129 secs)
[1A[2KChrome 143.0.0.0 (Windows 10): Executed 18 of 67[32m SUCCESS[39m (0 secs / 0.135 secs)
[1A[2KChrome 143.0.0.0 (Windows 10): Executed 19 of 67[32m SUCCESS[39m (0 secs / 0.14 secs)
[1A[2KChrome 143.0.0.0 (Windows 10): Executed 20 of 67[32m SUCCESS[39m (0 secs / 0.145 secs)
[1A[2KChrome 143.0.0.0 (Windows 10): Executed 21 of 67[32m SUCCESS[39m (0 secs / 0.151 secs)
[1A[2KChrome 143.0.0.0 (Windows 10): Executed 22 of 67[32m SUCCESS[39m (0 secs / 0.151 secs)
[1A[2KChrome 143.0.0.0 (Windows 10): Executed 23 of 67[32m SUCCESS[39m (0 secs / 0.151 secs)
[1A[2KChrome 143.0.0.0 (Windows 10): Executed 24 of 67[32m SUCCESS[39m (0 secs / 0.151 secs)
[1A[2KChrome 143.0.0.0 (Windows 10): Executed 25 of 67[32m SUCCESS[39m (0 secs / 0.151 secs)
[1A[2KChrome 143.0.0.0 (Windows 10): Executed 26 of 67[32m SUCCESS[39m (0 secs / 0.151 secs)
[1A[2KChrome 143.0.0.0 (Windows 10): Executed 27 of 67[32m SUCCESS[39m (0 secs / 0.151 secs)
[1A[2KChrome 143.0.0.0 (Windows 10): Executed 28 of 67[32m SUCCESS[39m (0 secs / 0.151 secs)
[1A[2KChrome 143.0.0.0 (Windows 10): Executed 29 of 67[32m SUCCESS[39m (0 secs / 0.151 secs)
[1A[2KChrome 143.0.0.0 (Windows 10): Executed 30 of 67[32m SUCCESS[39m (0 secs / 0.151 secs)
[1A[2KChrome 143.0.0.0 (Windows 10): Executed 31 of 67[32m SUCCESS[39m (0 secs / 0.151 secs)
[1A[2KChrome 143.0.0.0 (Windows 10): Executed 32 of 67[32m SUCCESS[39m (0 secs / 0.151 secs)
[1A[2KChrome 143.0.0.0 (Windows 10): Executed 33 of 67[32m SUCCESS[39m (0 secs / 0.16 secs)
[1A[2KChrome 143.0.0.0 (Windows 10): Executed 34 of 67[32m SUCCESS[39m (0 secs / 0.163 secs)
[1A[2KChrome 143.0.0.0 (Windows 10): Executed 35 of 67[32m SUCCESS[39m (0 secs / 0.164 secs)
[1A[2KChrome 143.0.0.0 (Windows 10): Executed 36 of 67[32m SUCCESS[39m (0 secs / 0.165 secs)
[1A[2KChrome 143.0.0.0 (Windows 10): Executed 37 of 67[32m SUCCESS[39m (0 secs / 0.166 secs)
[1A[2KChrome 143.0.0.0 (Windows 10): Executed 38 of 67[32m SUCCESS[39m (0 secs / 0.168 secs)
[1A[2KChrome 143.0.0.0 (Windows 10): Executed 39 of 67[32m SUCCESS[39m (0 secs / 0.17 secs)
[1A[2KChrome 143.0.0.0 (Windows 10): Executed 40 of 67[32m SUCCESS[39m (0 secs / 0.172 secs)
[1A[2KChrome 143.0.0.0 (Windows 10): Executed 41 of 67[32m SUCCESS[39m (0 secs / 0.173 secs)
[1A[2KChrome 143.0.0.0 (Windows 10): Executed 42 of 67[32m SUCCESS[39m (0 secs / 0.174 secs)
[1A[2KChrome 143.0.0.0 (Windows 10): Executed 43 of 67[32m SUCCESS[39m (0 secs / 0.176 secs)
[1A[2KChrome 143.0.0.0 (Windows 10): Executed 44 of 67[32m SUCCESS[39m (0 secs / 0.178 secs)
[1A[2KChrome 143.0.0.0 (Windows 10): Executed 45 of 67[32m SUCCESS[39m (0 secs / 0.18 secs)
[1A[2KChrome 143.0.0.0 (Windows 10): Executed 46 of 67[32m SUCCESS[39m (0 secs / 0.181 secs)
[1A[2KChrome 143.0.0.0 (Windows 10): Executed 47 of 67[32m SUCCESS[39m (0 secs / 0.183 secs)
[1A[2KChrome 143.0.0.0 (Windows 10): Executed 48 of 67[32m SUCCESS[39m (0 secs / 0.184 secs)
[1A[2KChrome 143.0.0.0 (Windows 10): Executed 49 of 67[32m SUCCESS[39m (0 secs / 0.186 secs)
[1A[2KChrome 143.0.0.0 (Windows 10): Executed 50 of 67[32m SUCCESS[39m (0 secs / 0.188 secs)
[1A[2KChrome 143.0.0.0 (Windows 10): Executed 51 of 67[32m SUCCESS[39m (0 secs / 0.19 secs)
[1A[2KChrome 143.0.0.0 (Windows 10): Executed 52 of 67[32m SUCCESS[39m (0 secs / 0.191 secs)
[1A[2KChrome 143.0.0.0 (Windows 10): Executed 53 of 67[32m SUCCESS[39m (0 secs / 0.192 secs)
[1A[2KChrome 143.0.0.0 (Windows 10): Executed 54 of 67[32m SUCCESS[39m (0 secs / 0.194 secs)
[1A[2KChrome 143.0.0.0 (Windows 10): Executed 55 of 67[32m SUCCESS[39m (0 secs / 0.196 secs)
[1A[2KChrome 143.0.0.0 (Windows 10): Executed 56 of 67[32m SUCCESS[39m (0 secs / 0.196 secs)
[1A[2KChrome 143.0.0.0 (Windows 10): Executed 57 of 67[32m SUCCESS[39m (0 secs / 0.196 secs)
[1A[2KChrome 143.0.0.0 (Windows 10): Executed 58 of 67[32m SUCCESS[39m (0 secs / 0.196 secs)
[1A[2KChrome 143.0.0.0 (Windows 10): Executed 59 of 67[32m SUCCESS[39m (0 secs / 0.196 secs)
[1A[2KChrome 143.0.0.0 (Windows 10): Executed 60 of 67[32m SUCCESS[39m (0 secs / 0.197 secs)
[1A[2KChrome 143.0.0.0 (Windows 10): Executed 61 of 67[32m SUCCESS[39m (0 secs / 0.197 secs)
[1A[2KChrome 143.0.0.0 (Windows 10): Executed 62 of 67[32m SUCCESS[39m (0 secs / 0.198 secs)
[1A[2KChrome 143.0.0.0 (Windows 10): Executed 63 of 67[32m SUCCESS[39m (0 secs / 0.198 secs)
[1A[2KChrome 143.0.0.0 (Windows 10): Executed 64 of 67[32m SUCCESS[39m (0 secs / 0.198 secs)
[1A[2KChrome 143.0.0.0 (Windows 10): Executed 65 of 67[32m SUCCESS[39m (0 secs / 0.198 secs)
[1A[2KChrome 143.0.0.0 (Windows 10): Executed 66 of 67[32m SUCCESS[39m (0 secs / 0.199 secs)
[1A[2KChrome 143.0.0.0 (Windows 10): Executed 67 of 67[32m SUCCESS[39m (0 secs / 0.199 secs)
[1A[2KChrome 143.0.0.0 (Windows 10): Executed 67 of 67[32m SUCCESS[39m (0.251 secs / 0.199 secs)
[32mTOTAL: 67 SUCCESS[39m
[1A[2K[31mChrome 143.0.0.0 (Windows 10) ERROR[39m
  Some of your tests did a full page reload!
Chrome 143.0.0.0 (Windows 10): Executed 67 of 67[32m SUCCESS[39m (0.251 secs / 0.199 secs)
Chrome 143.0.0.0 (Windows 10) ERROR
  Some of your tests did a full page reload!
[33m23 12 2025 13:21:26.898:WARN [Chrome 143.0.0.0 (Windows 10)]: [39mDisconnected (0 times) Client disconnected from CONNECTED state (transport close)
[1A[2K[31mChrome 143.0.0.0 (Windows 10) ERROR[39m
  Disconnected Client disconnected from CONNECTED state (transport close)
Chrome 143.0.0.0 (Windows 10): Executed 67 of 67[32m SUCCESS[39m (0.251 secs / 0.199 secs)
Chrome 143.0.0.0 (Windows 10) ERROR
  Disconnected Client disconnected from CONNECTED state (transport close)
[91m23 12 2025 13:21:27.151:ERROR [launcher]: [39mChrome crashed.
	[38508:19580:1223/132053.401:ERROR:components\device_event_log\device_event_log_impl.cc:198] [13:20:53.402] USB: usb_service_win.cc:105 SetupDiGetDeviceProperty({{A45C254E-DF1C-4EFD-8020-67D146A850E0}, 6}) failed: Element not found. (0x490)
[38508:29248:1223/132053.894:ERROR:google_apis\gcm\engine\registration_request.cc:292] Registration response error message: PHONE_REGISTRATION_ERROR
[38508:29248:1223/132053.897:ERROR:google_apis\gcm\engine\registration_request.cc:292] Registration response error message: DEPRECATED_ENDPOINT
[38508:29248:1223/132054.025:ERROR:google_apis\gcm\engine\mcs_client.cc:700]   Error code: 401  Error message: Authentication Failed: wrong_secret
[38508:29248:1223/132054.025:ERROR:google_apis\gcm\engine\mcs_client.cc:702] Failed to log in to GCM, resetting connection.
Created TensorFlow Lite XNNPACK delegate for CPU.
[38508:29248:1223/132117.647:ERROR:google_apis\gcm\engine\registration_request.cc:292] Registration response error message: DEPRECATED_ENDPOINT

[91m23 12 2025 13:21:27.152:ERROR [launcher]: [39mChrome stdout: 
[91m23 12 2025 13:21:27.152:ERROR [launcher]: [39mChrome stderr: [38508:19580:1223/132053.401:ERROR:components\device_event_log\device_event_log_impl.cc:198] [13:20:53.402] USB: usb_service_win.cc:105 SetupDiGetDeviceProperty({{A45C254E-DF1C-4EFD-8020-67D146A850E0}, 6}) failed: Element not found. (0x490)
[38508:29248:1223/132053.894:ERROR:google_apis\gcm\engine\registration_request.cc:292] Registration response error message: PHONE_REGISTRATION_ERROR
[38508:29248:1223/132053.897:ERROR:google_apis\gcm\engine\registration_request.cc:292] Registration response error message: DEPRECATED_ENDPOINT
[38508:29248:1223/132054.025:ERROR:google_apis\gcm\engine\mcs_client.cc:700]   Error code: 401  Error message: Authentication Failed: wrong_secret
[38508:29248:1223/132054.025:ERROR:google_apis\gcm\engine\mcs_client.cc:702] Failed to log in to GCM, resetting connection.
Created TensorFlow Lite XNNPACK delegate for CPU.
[38508:29248:1223/132117.647:ERROR:google_apis\gcm\engine\registration_request.cc:292] Registration response error message: DEPRECATED_ENDPOINT

[32m23 12 2025 13:21:27.293:INFO [launcher]: [39mTrying to start Chrome again (1/2).
[32m23 12 2025 13:21:28.723:INFO [Chrome 143.0.0.0 (Windows 10)]: [39mConnected on socket k5mjUdpk90Q1qPUgAAAD with id 22424111
[33m23 12 2025 13:21:28.805:WARN [Chrome 143.0.0.0 (Windows 10)]: [39mDisconnected (0 times) Client disconnected from CONNECTED state (transport error)
[31mChrome 143.0.0.0 (Windows 10) ERROR[39m
  Disconnected Client disconnected from CONNECTED state (transport error)

Chrome 143.0.0.0 (Windows 10) ERROR
  Disconnected Client disconnected from CONNECTED state (transport error)
[91m23 12 2025 13:21:29.045:ERROR [launcher]: [39mChrome crashed.
	
[91m23 12 2025 13:21:29.045:ERROR [launcher]: [39mChrome stdout: 
[91m23 12 2025 13:21:29.045:ERROR [launcher]: [39mChrome stderr: 
[32m23 12 2025 13:21:29.134:INFO [launcher]: [39mTrying to start Chrome again (2/2).
[32m23 12 2025 13:21:30.698:INFO [Chrome 143.0.0.0 (Windows 10)]: [39mConnected on socket AUjFLL4exUXJELSzAAAF with id 22424111
Chrome 143.0.0.0 (Windows 10): Executed 0 of 67[32m SUCCESS[39m (0 secs / 0 secs)
[1A[2KChrome 143.0.0.0 (Windows 10): Executed 1 of 67[32m SUCCESS[39m (0 secs / 0.016 secs)
[1A[2KChrome 143.0.0.0 (Windows 10): Executed 2 of 67[32m SUCCESS[39m (0 secs / 0.019 secs)
[1A[2KChrome 143.0.0.0 (Windows 10): Executed 3 of 67[32m SUCCESS[39m (0 secs / 0.021 secs)
[1A[2KChrome 143.0.0.0 (Windows 10): Executed 4 of 67[32m SUCCESS[39m (0 secs / 0.024 secs)
[1A[2KChrome 143.0.0.0 (Windows 10): Executed 5 of 67[32m SUCCESS[39m (0 secs / 0.027 secs)
[1A[2KChrome 143.0.0.0 (Windows 10): Executed 6 of 67[32m SUCCESS[39m (0 secs / 0.03 secs)
[1A[2KChrome 143.0.0.0 (Windows 10): Executed 7 of 67[32m SUCCESS[39m (0 secs / 0.033 secs)
[1A[2KChrome 143.0.0.0 (Windows 10): Executed 8 of 67[32m SUCCESS[39m (0 secs / 0.036 secs)
[1A[2KChrome 143.0.0.0 (Windows 10): Executed 9 of 67[32m SUCCESS[39m (0 secs / 0.039 secs)
[1A[2KChrome 143.0.0.0 (Windows 10): Executed 10 of 67[32m SUCCESS[39m (0 secs / 0.042 secs)
[1A[2KChrome 143.0.0.0 (Windows 10): Executed 11 of 67[32m SUCCESS[39m (0 secs / 0.043 secs)
[1A[2KChrome 143.0.0.0 (Windows 10): Executed 12 of 67[32m SUCCESS[39m (0 secs / 0.045 secs)
[1A[2KChrome 143.0.0.0 (Windows 10): Executed 13 of 67[32m SUCCESS[39m (0 secs / 0.046 secs)
[1A[2KChrome 143.0.0.0 (Windows 10): Executed 14 of 67[32m SUCCESS[39m (0 secs / 0.047 secs)
[1A[2KChrome 143.0.0.0 (Windows 10): Executed 15 of 67[32m SUCCESS[39m (0 secs / 0.048 secs)
[1A[2KChrome 143.0.0.0 (Windows 10): Executed 16 of 67[32m SUCCESS[39m (0 secs / 0.048 secs)
[1A[2KChrome 143.0.0.0 (Windows 10): Executed 17 of 67[32m SUCCESS[39m (0 secs / 0.048 secs)
[1A[2KChrome 143.0.0.0 (Windows 10): Executed 18 of 67[32m SUCCESS[39m (0 secs / 0.048 secs)
[1A[2KChrome 143.0.0.0 (Windows 10): Executed 19 of 67[32m SUCCESS[39m (0 secs / 0.048 secs)
[1A[2KChrome 143.0.0.0 (Windows 10): Executed 20 of 67[32m SUCCESS[39m (0 secs / 0.048 secs)
[1A[2KChrome 143.0.0.0 (Windows 10): Executed 21 of 67[32m SUCCESS[39m (0 secs / 0.048 secs)
[1A[2KChrome 143.0.0.0 (Windows 10): Executed 22 of 67[32m SUCCESS[39m (0 secs / 0.048 secs)
[1A[2KChrome 143.0.0.0 (Windows 10): Executed 23 of 67[32m SUCCESS[39m (0 secs / 0.048 secs)
[1A[2KChrome 143.0.0.0 (Windows 10): Executed 24 of 67[32m SUCCESS[39m (0 secs / 0.048 secs)
[1A[2KChrome 143.0.0.0 (Windows 10): Executed 25 of 67[32m SUCCESS[39m (0 secs / 0.048 secs)
[1A[2KChrome 143.0.0.0 (Windows 10): Executed 26 of 67[32m SUCCESS[39m (0 secs / 0.048 secs)
[1A[2KChrome 143.0.0.0 (Windows 10): Executed 27 of 67[32m SUCCESS[39m (0 secs / 0.051 secs)
[1A[2KChrome 143.0.0.0 (Windows 10): Executed 28 of 67[32m SUCCESS[39m (0 secs / 0.054 secs)
[1A[2KChrome 143.0.0.0 (Windows 10): Executed 29 of 67[32m SUCCESS[39m (0 secs / 0.057 secs)
[1A[2KChrome 143.0.0.0 (Windows 10): Executed 30 of 67[32m SUCCESS[39m (0 secs / 0.059 secs)
[1A[2KChrome 143.0.0.0 (Windows 10): Executed 31 of 67[32m SUCCESS[39m (0 secs / 0.06 secs)
[1A[2KChrome 143.0.0.0 (Windows 10): Executed 32 of 67[32m SUCCESS[39m (0 secs / 0.062 secs)
[1A[2KChrome 143.0.0.0 (Windows 10): Executed 33 of 67[32m SUCCESS[39m (0 secs / 0.064 secs)
[1A[2KChrome 143.0.0.0 (Windows 10): Executed 34 of 67[32m SUCCESS[39m (0 secs / 0.066 secs)
[1A[2KChrome 143.0.0.0 (Windows 10): Executed 35 of 67[32m SUCCESS[39m (0 secs / 0.066 secs)
[1A[2KChrome 143.0.0.0 (Windows 10): Executed 36 of 67[32m SUCCESS[39m (0 secs / 0.066 secs)
[1A[2KChrome 143.0.0.0 (Windows 10): Executed 37 of 67[32m SUCCESS[39m (0 secs / 0.066 secs)
[1A[2KChrome 143.0.0.0 (Windows 10): Executed 38 of 67[32m SUCCESS[39m (0 secs / 0.066 secs)
[1A[2KChrome 143.0.0.0 (Windows 10): Executed 39 of 67[32m SUCCESS[39m (0 secs / 0.067 secs)
[1A[2KChrome 143.0.0.0 (Windows 10): Executed 40 of 67[32m SUCCESS[39m (0 secs / 0.067 secs)
[1A[2KChrome 143.0.0.0 (Windows 10): Executed 41 of 67[32m SUCCESS[39m (0 secs / 0.068 secs)
[1A[2KChrome 143.0.0.0 (Windows 10): Executed 42 of 67[32m SUCCESS[39m (0 secs / 0.068 secs)
[1A[2KChrome 143.0.0.0 (Windows 10): Executed 43 of 67[32m SUCCESS[39m (0 secs / 0.069 secs)
[1A[2KChrome 143.0.0.0 (Windows 10): Executed 44 of 67[32m SUCCESS[39m (0 secs / 0.069 secs)
[1A[2KChrome 143.0.0.0 (Windows 10): Executed 45 of 67[32m SUCCESS[39m (0 secs / 0.069 secs)
[1A[2KChrome 143.0.0.0 (Windows 10): Executed 46 of 67[32m SUCCESS[39m (0 secs / 0.143 secs)
[1A[2KChrome 143.0.0.0 (Windows 10): Executed 47 of 67[32m SUCCESS[39m (0 secs / 0.154 secs)
[1A[2KChrome 143.0.0.0 (Windows 10): Executed 48 of 67[32m SUCCESS[39m (0 secs / 0.162 secs)
[1A[2KChrome 143.0.0.0 (Windows 10): Executed 49 of 67[32m SUCCESS[39m (0 secs / 0.171 secs)
[1A[2KChrome 143.0.0.0 (Windows 10): Executed 50 of 67[32m SUCCESS[39m (0 secs / 0.179 secs)
[1A[2KChrome 143.0.0.0 (Windows 10): Executed 51 of 67[32m SUCCESS[39m (0 secs / 0.188 secs)
[1A[2KChrome 143.0.0.0 (Windows 10): Executed 52 of 67[32m SUCCESS[39m (0 secs / 0.197 secs)
[1A[2KChrome 143.0.0.0 (Windows 10): Executed 53 of 67[32m SUCCESS[39m (0 secs / 0.205 secs)
[1A[2KChrome 143.0.0.0 (Windows 10): Executed 54 of 67[32m SUCCESS[39m (0 secs / 0.214 secs)
[1A[2KChrome 143.0.0.0 (Windows 10): Executed 55 of 67[32m SUCCESS[39m (0 secs / 0.223 secs)
[1A[2KChrome 143.0.0.0 (Windows 10): Executed 56 of 67[32m SUCCESS[39m (0 secs / 0.23 secs)
[1A[2KChrome 143.0.0.0 (Windows 10): Executed 57 of 67[32m SUCCESS[39m (0 secs / 0.238 secs)
[1A[2KChrome 143.0.0.0 (Windows 10): Executed 58 of 67[32m SUCCESS[39m (0 secs / 0.251 secs)
[1A[2KChrome 143.0.0.0 (Windows 10): Executed 59 of 67[32m SUCCESS[39m (0 secs / 0.253 secs)
[1A[2KChrome 143.0.0.0 (Windows 10): Executed 60 of 67[32m SUCCESS[39m (0 secs / 0.256 secs)
[1A[2KChrome 143.0.0.0 (Windows 10): Executed 61 of 67[32m SUCCESS[39m (0 secs / 0.258 secs)
[1A[2KChrome 143.0.0.0 (Windows 10): Executed 62 of 67[32m SUCCESS[39m (0 secs / 0.26 secs)
[1A[2KChrome 143.0.0.0 (Windows 10): Executed 63 of 67[32m SUCCESS[39m (0 secs / 0.261 secs)
[1A[2KChrome 143.0.0.0 (Windows 10): Executed 64 of 67[32m SUCCESS[39m (0 secs / 0.263 secs)
[1A[2KChrome 143.0.0.0 (Windows 10): Executed 65 of 67[32m SUCCESS[39m (0 secs / 0.265 secs)
[1A[2KChrome 143.0.0.0 (Windows 10): Executed 66 of 67[32m SUCCESS[39m (0 secs / 0.268 secs)
[1A[2KChrome 143.0.0.0 (Windows 10): Executed 67 of 67[32m SUCCESS[39m (0 secs / 0.294 secs)
[1A[2KChrome 143.0.0.0 (Windows 10): Executed 67 of 67[32m SUCCESS[39m (0.347 secs / 0.294 secs)
[32mTOTAL: 67 SUCCESS[39m
[1A[2K[31mChrome 143.0.0.0 (Windows 10) ERROR[39m
  Some of your tests did a full page reload!
Chrome 143.0.0.0 (Windows 10): Executed 67 of 67[32m SUCCESS[39m (0.347 secs / 0.294 secs)
Chrome 143.0.0.0 (Windows 10) ERROR
  Some of your tests did a full page reload!
[33m23 12 2025 13:21:35.645:WARN [Chrome 143.0.0.0 (Windows 10)]: [39mDisconnected (0 times) Client disconnected from CONNECTED state (transport close)
[1A[2K[31mChrome 143.0.0.0 (Windows 10) ERROR[39m
  Disconnected Client disconnected from CONNECTED state (transport close)
Chrome 143.0.0.0 (Windows 10): Executed 67 of 67[32m SUCCESS[39m (0.347 secs / 0.294 secs)
Chrome 143.0.0.0 (Windows 10) ERROR
  Disconnected Client disconnected from CONNECTED state (transport close)
[91m23 12 2025 13:21:35.869:ERROR [launcher]: [39mChrome crashed.
	[35248:38200:1223/132134.839:ERROR:components\device_event_log\device_event_log_impl.cc:198] [13:21:34.840] USB: usb_service_win.cc:105 SetupDiGetDeviceProperty({{A45C254E-DF1C-4EFD-8020-67D146A850E0}, 6}) failed: Element not found. (0x490)
[35248:38024:1223/132135.372:ERROR:google_apis\gcm\engine\registration_request.cc:292] Registration response error message: DEPRECATED_ENDPOINT

[91m23 12 2025 13:21:35.869:ERROR [launcher]: [39mChrome stdout: 
[91m23 12 2025 13:21:35.869:ERROR [launcher]: [39mChrome stderr: [35248:38200:1223/132134.839:ERROR:components\device_event_log\device_event_log_impl.cc:198] [13:21:34.840] USB: usb_service_win.cc:105 SetupDiGetDeviceProperty({{A45C254E-DF1C-4EFD-8020-67D146A850E0}, 6}) failed: Element not found. (0x490)
[35248:38024:1223/132135.372:ERROR:google_apis\gcm\engine\registration_request.cc:292] Registration response error message: DEPRECATED_ENDPOINT

[91m23 12 2025 13:21:36.009:ERROR [launcher]: [39mChrome failed 2 times (crashed). Giving up.
[33m23 12 2025 13:21:55.940:WARN [Chrome 143.0.0.0 (Windows 10)]: [39mDisconnected (1 times) , because no message in 30000 ms.
[1A[2K[31mChrome 143.0.0.0 (Windows 10) ERROR[39m
  Disconnected , because no message in 30000 ms.
Chrome 143.0.0.0 (Windows 10): Executed 67 of 67[32m SUCCESS[39m (0.347 secs / 0.294 secs)
Chrome 143.0.0.0 (Windows 10) ERROR
  Disconnected , because no message in 30000 ms.
[1A[2KChrome 143.0.0.0 (Windows 10): Executed 67 of 67[32m SUCCESS[39m (0.347 secs / 0.294 secs)
[33m23 12 2025 13:22:05.635:WARN [Chrome 143.0.0.0 (Windows 10)]: [39mDisconnected (1 times) , because no message in 30000 ms.
[1A[2K[31mChrome 143.0.0.0 (Windows 10) ERROR[39m
  Disconnected , because no message in 30000 ms.
Chrome 143.0.0.0 (Windows 10): Executed 67 of 67[31m DISCONNECTED[39m (34.201 secs / 0.294 secs)
Chrome 143.0.0.0 (Windows 10) ERROR
  Disconnected , because no message in 30000 ms.
[1A[2KChrome 143.0.0.0 (Windows 10): Executed 67 of 67[31m DISCONNECTED[39m (34.201 secs / 0.294 secs)
